{
  "page_id": "cp001-p01-page-01",
  "version": 1,
  "viewport_mode": "mobile_vertical",
  "frame_aspect_ratio": "4:3",
  "frames": [
    {
      "frame_id": "f1",
      "scene_id": "cp001_p01_s1",
      "image_slot": {
        "asset_key": "cp001-p01-page-01-f1",
        "aspect_ratio": "4:3",
        "crop_mode": "contain"
      },
      "text_block": {
        "title": "龙椅惊蛇",
        "items": [
          {
            "id": "f1_t1",
            "kind": "caption",
            "speaker": "narrator",
            "text": "话说天下大势，分久必合，合久必分。汉朝传了四百年，到了桓帝灵帝手上，气数尽了。",
            "lang": "zh-CN"
          }
        ]
      }
    },
    {
      "frame_id": "f2",
      "scene_id": "cp001_p01_s2",
      "image_slot": {
        "asset_key": "cp001-p01-page-01-f2",
        "aspect_ratio": "4:3",
        "crop_mode": "contain"
      },
      "text_block": {
        "title": "暗流涌动",
        "items": [
          {
            "id": "f2_t1",
            "kind": "caption",
            "speaker": "narrator",
            "text": "巨鹿张角，本是个落第秀才。入山采药，得了天书《太平要术》，学会符水治病，信徒越滚越多，遍布八州。",
            "lang": "zh-CN"
          }
        ]
      }
    },
    {
      "frame_id": "f3",
      "scene_id": "cp001_p01_s2",
      "image_slot": {
        "asset_key": "cp001-p01-page-01-f3",
        "aspect_ratio": "4:3",
        "crop_mode": "contain"
      },
      "text_block": {
        "title": "黄巾洪流",
        "items": [
          {
            "id": "f3_t1",
            "kind": "caption",
            "speaker": "narrator",
            "text": "苍天已死，黄天当立。岁在甲子，天下大吉。四方裹黄巾从反者四五十万，官军望风而逃。",
            "lang": "zh-CN"
          }
        ]
      }
    },
    {
      "frame_id": "f4",
      "scene_id": "cp001_p01_s3",
      "image_slot": {
        "asset_key": "cp001-p01-page-01-f4",
        "aspect_ratio": "4:3",
        "crop_mode": "contain"
      },
      "text_block": {
        "title": "榜文",
        "items": [
          {
            "id": "f4_t1",
            "kind": "caption",
            "speaker": "narrator",
            "text": "幽州太守刘焉出榜招兵。几天之内，各县城门口都贴上了同一张纸。",
            "lang": "zh-CN"
          },
          {
            "id": "f4_t2",
            "kind": "caption",
            "speaker": "narrator",
            "text": "没有人知道它会引来什么样的人。",
            "lang": "zh-CN"
          }
        ]
      }
    }
  ]
}
