{
  "page_id": "cp001-p04-page-01",
  "version": 1,
  "viewport_mode": "mobile_vertical",
  "frame_aspect_ratio": "4:3",
  "frames": [
    {
      "frame_id": "f1",
      "scene_id": "cp001_p04_s1",
      "image_slot": {
        "asset_key": "cp001-p04-page-01-f1",
        "aspect_ratio": "4:3",
        "crop_mode": "contain"
      },
      "text_block": {
        "title": "五百对五万",
        "items": [
          {
            "id": "f1_t1",
            "kind": "caption",
            "speaker": "narrator",
            "text": "五百对五万。邹靖没说话，领了令。刘备、关羽、张飞也没说话，领了兵。",
            "lang": "zh-CN"
          }
        ]
      }
    },
    {
      "frame_id": "f2",
      "scene_id": "cp001_p04_s1",
      "image_slot": {
        "asset_key": "cp001-p04-page-01-f2",
        "aspect_ratio": "4:3",
        "crop_mode": "contain"
      },
      "text_block": {
        "title": "一矛一刀",
        "items": [
          {
            "id": "f2_t1",
            "kind": "caption",
            "speaker": "narrator",
            "text": "张飞一矛刺中邓茂心窝。程远志冲过来，关羽一刀劈成两段。快得像闪电。",
            "lang": "zh-CN"
          }
        ]
      }
    },
    {
      "frame_id": "f3",
      "scene_id": "cp001_p04_s2",
      "image_slot": {
        "asset_key": "cp001-p04-page-01-f3",
        "aspect_ratio": "4:3",
        "crop_mode": "contain"
      },
      "text_block": {
        "title": "油灯下的计策",
        "items": [
          {
            "id": "f3_t1",
            "kind": "speech",
            "speaker": "liu_bei",
            "text": "贼众我寡，硬打不行。云长埋伏山左，翼德埋伏山右。我诱敌过来，鸣金为号，三路齐出。",
            "lang": "zh-CN"
          }
        ]
      }
    },
    {
      "frame_id": "f4",
      "scene_id": "cp001_p04_s2",
      "image_slot": {
        "asset_key": "cp001-p04-page-01-f4",
        "aspect_ratio": "4:3",
        "crop_mode": "contain"
      },
      "text_block": {
        "title": "三路夹攻",
        "items": [
          {
            "id": "f4_t1",
            "kind": "caption",
            "speaker": "narrator",
            "text": "三路人马像三把刀同时劈下去。黄巾军彻底散了。",
            "lang": "zh-CN"
          }
        ]
      }
    },
    {
      "frame_id": "f5",
      "scene_id": "cp001_p04_s3",
      "image_slot": {
        "asset_key": "cp001-p04-page-01-f5",
        "aspect_ratio": "4:3",
        "crop_mode": "contain"
      },
      "text_block": {
        "title": "来了就好",
        "items": [
          {
            "id": "f5_t1",
            "kind": "speech",
            "speaker": "lu_zhi",
            "text": "来了就好。",
            "lang": "zh-CN"
          },
          {
            "id": "f5_t2",
            "kind": "caption",
            "speaker": "narrator",
            "text": "刀还没冷，仗还没打完。",
            "lang": "zh-CN"
          }
        ]
      }
    }
  ]
}
