{
  "page_id": "cp001-p03-page-01",
  "version": 2,
  "viewport_mode": "mobile_vertical",
  "frame_aspect_ratio": "4:3",
  "frames": [
    {
      "frame_id": "f1",
      "scene_id": "cp001_p03_s1",
      "image_slot": {
        "asset_key": "cp001-p03-page-01-f1",
        "aspect_ratio": "4:3",
        "crop_mode": "contain"
      },
      "text_block": {
        "title": "关羽登场",
        "items": [
          {
            "id": "f1_t1",
            "kind": "speech",
            "speaker": "guan_yu",
            "text": "快上一碗酒，我还得进城投军。",
            "lang": "zh-CN"
          },
          {
            "id": "f1_t2",
            "kind": "speech",
            "speaker": "liu_bei",
            "text": "壮士，不嫌弃的话，坐下一起喝一杯？",
            "lang": "zh-CN"
          }
        ]
      }
    },
    {
      "frame_id": "f2",
      "scene_id": "cp001_p03_s2",
      "image_slot": {
        "asset_key": "cp001-p03-page-01-f2",
        "aspect_ratio": "4:3",
        "crop_mode": "contain"
      },
      "text_block": {
        "title": "桃园结义",
        "items": [
          {
            "id": "f2_t1",
            "kind": "caption",
            "speaker": "narrator",
            "text": "我三人今日结为兄弟。",
            "lang": "zh-CN"
          },
          {
            "id": "f2_t2",
            "kind": "speech",
            "speaker": "all",
            "text": "不求同生，但求同死。",
            "lang": "zh-CN"
          }
        ]
      }
    },
    {
      "frame_id": "f3",
      "scene_id": "cp001_p03_s3",
      "image_slot": {
        "asset_key": "cp001-p03-page-01-f3",
        "aspect_ratio": "4:3",
        "crop_mode": "contain"
      },
      "text_block": {
        "title": "起兵成军",
        "items": [
          {
            "id": "f3_t1",
            "kind": "speech",
            "speaker": "merchant",
            "text": "良马五十匹，金银五百两，镔铁一千斤，都送你们。",
            "lang": "zh-CN"
          }
        ]
      }
    },
    {
      "frame_id": "f4",
      "scene_id": "cp001_p03_s3",
      "image_slot": {
        "asset_key": "cp001-p03-page-01-f4",
        "aspect_ratio": "4:3",
        "crop_mode": "contain"
      },
      "text_block": {
        "title": "正式上路",
        "items": [
          {
            "id": "f4_t1",
            "kind": "caption",
            "speaker": "narrator",
            "text": "从此，三兄弟带着队伍上路了。",
            "lang": "zh-CN"
          }
        ]
      }
    }
  ]
}
